### ISSUE TITLE
IPv6 HTTP Host Header incorrect

### ISSUE THREAD

**Issue by fungaren** [geventhttpclient/geventhttpclient#162]
```python
#!/usr/bin/python3

from geventhttpclient import HTTPClient
from geventhttpclient.url import URL

#url = URL('http://127.0.0.1/')
url = URL('http://[::1]:80/')

http = HTTPClient(url.host)

# issue a get request
response = http.get(url.request_uri)

# read status_code
print(response.status_code)

# read response body
body = response.read()

# close connections
http.close()
```

TCPDUMP:

```text
19:09:49.130122 IP6 (flowlabel 0x690dd, hlim 64, next-header TCP (6) payload length: 40) localhost.55506 > localhost.http: Flags [S], cksum 0x0030 (incorrect -> 0x09c6), seq 2316960059, win 43690, options [mss 65476,sackOK,TS val 2822933695 ecr 0,nop,wscale 10], length 0
19:09:49.130152 IP6 (flowlabel 0x12ed8, hlim 64, next-header TCP (6) payload length: 40) localhost.http > localhost.55506: Flags [S.], cksum 0x0030 (incorrect -> 0x51cb), seq 1181891701, ack 2316960060, win 43690, options [mss 65476,sackOK,TS val 2822933695 ecr 2822933695,nop,wscale 10], length 0
19:09:49.130172 IP6 (flowlabel 0x690dd, hlim 64, next-header TCP (6) payload length: 32) localhost.55506 > localhost.http: Flags [.], cksum 0x0028 (incorrect -> 0x252b), seq 1, ack 1, win 43, options [nop,nop,TS val 2822933695 ecr 2822933695], length 0
19:09:49.130491 IP6 (flowlabel 0x690dd, hlim 64, next-header TCP (6) payload length: 106) localhost.55506 > localhost.http: Flags [P.], cksum 0x0072 (incorrect -> 0x2bea), seq 1:75, ack 1, win 43, options [nop,nop,TS val 2822933696 ecr 2822933695], length 74: HTTP, length: 74
        GET / HTTP/1.1
        user-agent: python/gevent-http-client-1.5.3
        host: ::1

19:09:49.130518 IP6 (flowlabel 0x12ed8, hlim 64, next-header TCP (6) payload length: 32) localhost.http > localhost.55506: Flags [.], cksum 0x0028 (incorrect -> 0x24df), seq 1, ack 75, win 43, options [nop,nop,TS val 2822933696 ecr 2822933696], length 0
19:09:49.130624 IP6 (flowlabel 0x12ed8, hlim 64, next-header TCP (6) payload length: 357) localhost.http > localhost.55506: Flags [P.], cksum 0x016d (incorrect -> 0x8ec3), seq 1:326, ack 75, win 43, options [nop,nop,TS val 2822933696 ecr 2822933696], length 325: HTTP, length: 325
        HTTP/1.1 400 Bad Request
        Server: nginx/1.14.2
        Date: Wed, 27 Jul 2022 11:09:49 GMT
        Content-Type: text/html
        Content-Length: 173
        Connection: close

        <html>
        <head><title>400 Bad Request</title></head>
        <body bgcolor="white">
        <center><h1>400 Bad Request</h1></center>
        <hr><center>nginx/1.14.2</center>
        </body>
        </html>
19:09:49.130634 IP6 (flowlabel 0x690dd, hlim 64, next-header TCP (6) payload length: 32) localhost.55506 > localhost.http: Flags [.], cksum 0x0028 (incorrect -> 0x239a), seq 75, ack 326, win 43, options [nop,nop,TS val 2822933696 ecr 2822933696], length 0
19:09:49.130649 IP6 (flowlabel 0x12ed8, hlim 64, next-header TCP (6) payload length: 32) localhost.http > localhost.55506: Flags [F.], cksum 0x0028 (incorrect -> 0x2399), seq 326, ack 75, win 43, options [nop,nop,TS val 2822933696 ecr 2822933696], length 0
19:09:49.130777 IP6 (flowlabel 0x690dd, hlim 64, next-header TCP (6) payload length: 32) localhost.55506 > localhost.http: Flags [F.], cksum 0x0028 (incorrect -> 0x2398), seq 75, ack 327, win 43, options [nop,nop,TS val 2822933696 ecr 2822933696], length 0
19:09:49.130798 IP6 (flowlabel 0x12ed8, hlim 64, next-header TCP (6) payload length: 32) localhost.http > localhost.55506: Flags [.], cksum 0x0028 (incorrect -> 0x2398), seq 327, ack 76, win 43, options [nop,nop,TS val 2822933696 ecr 2822933696], length 0
```

Apparently the HTTP Host header is incorrect. The IPv6 address should be surrounded by `[]`:

```text
19:10:59.870534 IP6 (flowlabel 0x7f01c, hlim 64, next-header TCP (6) payload length: 101) localhost.55778 > localhost.http: Flags [P.], cksum 0x006d (incorrect -> 0xf430), seq 1:70, ack 1, win 43, options [nop,nop,TS val 2823004436 ecr 2823004435], length 69: HTTP, length: 69
        GET / HTTP/1.1
        Host: [::1]
        User-Agent: curl/7.64.0
        Accept: */*

19:10:59.870552 IP6 (flowlabel 0x4bc57, hlim 64, next-header TCP (6) payload length: 32) localhost.http > localhost.55778: Flags [.], cksum 0x0028 (incorrect -> 0x1b8c), seq 1, ack 70, win 43, options [nop,nop,TS val 2823004436 ecr 2823004436], length 0
19:10:59.870770 IP6 (flowlabel 0x4bc57, hlim 64, next-header TCP (6) payload length: 882) localhost.http > localhost.55778: Flags [P.], cksum 0x037a (incorrect -> 0xf2e2), seq 1:851, ack 70, win 43, options [nop,nop,TS val 2823004436 ecr 2823004436], length 850: HTTP, length: 850
        HTTP/1.1 200 OK
        Server: nginx/1.14.2
        Date: Wed, 27 Jul 2022 11:10:59 GMT
        Content-Type: text/html
        Content-Length: 612
        Last-Modified: Wed, 27 Jul 2022 09:45:43 GMT
        Connection: keep-alive
        ETag: "62e10947-264"
        Accept-Ranges: bytes

        <!DOCTYPE html>
        <html>
        <head>
        <title>Welcome to nginx!</title>
```
